<?xml version="1.0" encoding="UTF-8"?>
<xs:schema xmlns:xs="http://www.w3.org/2001/XMLSchema">

	<xs:element name="features">
		<xs:complexType>
			<xs:sequence minOccurs="0" maxOccurs="unbounded">
				<xs:element name="feature" type="feature" />
			</xs:sequence>
		</xs:complexType>
		<xs:unique name="uniqueData">
			<xs:selector xpath="feature" />
			<xs:field xpath="name" />
		</xs:unique>
	</xs:element>

	<xs:complexType name="feature">
		<xs:sequence>
			<xs:element name="name" type="xs:token" maxOccurs="1"
				minOccurs="1" />
		</xs:sequence>
	</xs:complexType>

</xs:schema>